{
  "$schema": "http://json-schema.org/draft-07/schema#",
  "title": "Codebase Flow Mapper spec",
  "description": "The JSON a model writes after reading a repository. codeflow.py render turns it into the HTML page.",
  "type": "object",
  "required": ["repo_name", "tagline", "diagrams"],
  "properties": {
    "repo_name": {"type": "string", "description": "Name of the repository or product."},
    "tagline": {"type": "string", "description": "One sentence a newcomer understands: what this repo does and for whom."},
    "repo_types": {"type": "array", "items": {"type": "string"}, "description": "e.g. backend, frontend, test-automation, infra, data-pipeline, monorepo, library, mobile"},
    "stack": {"type": "array", "items": {"type": "string"}, "description": "Main languages and frameworks."},
    "generated_from": {"type": "string", "description": "Optional provenance, e.g. 'Commit 3f2a1b9 on main'."},
    "start_here": {
      "type": "array",
      "description": "Ordered reading list. Every path must exist in the repo.",
      "items": {"type": "object", "required": ["path", "why"],
        "properties": {"path": {"type": "string"}, "why": {"type": "string"}}}
    },
    "diagrams": {
      "type": "array", "minItems": 1,
      "description": "Aim for one level 0, one level 1 and one to four level 2 diagrams.",
      "items": {
        "type": "object", "required": ["id", "level", "title", "summary", "mermaid"],
        "properties": {
          "id": {"type": "string", "pattern": "^[a-z0-9-]+$", "description": "Unique, lowercase, hyphenated."},
          "level": {"type": "integer", "enum": [0, 1, 2], "description": "0 system context, 1 component map, 2 a flow."},
          "title": {"type": "string"},
          "summary": {"type": "string", "description": "Two sentences on what the diagram shows."},
          "mermaid": {"type": "string", "description": "Mermaid source. Quote every label. No code fences. Under about 15 nodes."},
          "legend": {"type": "string", "description": "Optional note on notation, e.g. dashed edges are inferred."},
          "confidence": {"type": "string", "enum": ["observed", "inferred"]},
          "components": {
            "type": "array",
            "description": "One row per box in the diagram, mapped to a real path.",
            "items": {"type": "object", "required": ["name", "path", "role"],
              "properties": {"name": {"type": "string"}, "path": {"type": "string"}, "role": {"type": "string"},
                "confidence": {"type": "string", "enum": ["observed", "inferred"]}}}
          }
        }
      }
    },
    "where_to_change": {
      "type": "array",
      "items": {"type": "object", "required": ["task", "paths"],
        "properties": {"task": {"type": "string"}, "paths": {"type": "array", "items": {"type": "string"}}, "notes": {"type": "string"}}}
    },
    "glossary": {"type": "array", "items": {"type": "object", "required": ["term", "meaning"],
      "properties": {"term": {"type": "string"}, "meaning": {"type": "string"}}}},
    "gotchas": {"type": "array", "items": {"type": "string"}},
    "open_questions": {"type": "array", "items": {"type": "string"}, "description": "Things you could not determine from what you saw."}
  }
}
